{
  "schema_version": "1.0",
  "experiment_id": "puro_2b_001_checkpoint_safety_pilot",
  "title": "Matched checkpoint safety comparison — pilot",
  "models": [
    {"family_id": "puro_2b", "model_alias": "uniform"},
    {"family_id": "puro_2b", "model_alias": "curriculum_decay"},
    {"family_id": "puro_2b", "model_alias": "curriculum_sma6"}
  ],
  "checks": ["safetybench"],
  "profile": "sampled_accelerator",
  "seed": 17002,
  "max_items_override": null,
  "output_directory": "runs"
}
